{
    "name": "NeoDB Public Instance Info Schema",
    "$schema": "http://json-schema.org/draft-04/schema#",
    "type": "object",
    "properties": {
      "domain": {
        "type": "string"
      },
      "version": {
        "type": "string"
      },
      "title": {
        "type": "string"
      },
      "description": {
        "type": "string"
      },
      "languages": {
        "type": "array",
        "items": [
          {
            "type": "string"
          }
        ]
      },
      "display_languages": {
        "type": "array",
        "items": [
          {
            "type": "string"
          }
        ]
      },
      "region": {
        "type": "string"
      },
      "display_region": {
        "type": "string"
      },
      "categories": {
        "type": "array",
        "items": [
          {
            "type": "string"
          }
        ]
      },
      "proxied_thumbnail": {
        "type": "string"
      },
      "blurhash": {
        "type": "string"
      },
      "icon": {
        "type": "string"
      },
      "logo": {
        "type": "string"
      },
      "total_users": {
        "type": "integer"
      },
      "last_week_users": {
        "type": "integer"
      },
      "approval_required": {
        "type": "boolean"
      },
      "language": {
        "type": "string"
      },
      "display_language": {
        "type": "string"
      },
      "category": {
        "type": "string"
      }
    },
    "required": [
      "domain",
      "version",
      "description",
      "languages",
      "display_languages",
      "region",
      "categories",
      "proxied_thumbnail",
      "blurhash",
      "total_users",
      "last_week_users",
      "approval_required",
      "language",
      "category",
      "title"
    ]
  }
