[
  {
    "domain": "neodb.social",
    "version": "4.0.4 (compatible; NeoDB 0.19.7-811753c-20261006202638)",
    "description": "Reviews about book, film, music, podcast and game.",
    "languages": [
      "en"
    ],
    "display_languages": [
      "English"
    ],
    "region": "",
    "categories": [
      "general"
    ],
    "proxied_thumbnail": "https://neodb.social/m/config/2026/9/4/kOP4N3AMFC4hJn_UCH5ObHKsiTk.png",
    "blurhash": "",
    "icon": "https://neodb.social/s/img/icon.png",
    "total_users": 36846,
    "last_week_users": 0,
    "approval_required": false,
    "language": "en",
    "display_language": "English",
    "category": "general",
    "title": "NeoDB",
    "logo": "https://neodb.social/s/img/logo.svg"
  },
  {
    "domain": "eggplant.place",
    "version": "4.0.4 (compatible; NeoDB main-b5cb292-20261007234838)",
    "description": "Reviews about book, film, music, podcast and game.",
    "languages": [
      "en"
    ],
    "display_languages": [
      "English"
    ],
    "region": "",
    "categories": [
      "general"
    ],
    "proxied_thumbnail": "https://eggplant.place/m/config/2024/1/15/zSi9h6bAWx05WG0QFjRglP47HCs.webp",
    "blurhash": "",
    "icon": "https://eggplant.place/logo2.png",
    "total_users": 924,
    "last_week_users": 0,
    "approval_required": false,
    "language": "en",
    "display_language": "English",
    "category": "general",
    "title": "Eggplant",
    "logo": "https://eggplant.place/logo2.png"
  }
]